#-----------------------------------------------------------
# Vivado v2020.2 (64-bit)
# SW Build 3064766 on Wed Nov 18 09:12:45 MST 2020
# IP Build 3064653 on Wed Nov 18 14:17:31 MST 2020
# Start of session at: Thu Apr 13 23:16:04 2023
# Process ID: 12560
# Current directory: C:/Users/daido/Desktop/Polimi/Anno 4/DESD/Git/KittCarPWM/jstk2_interface
# Command line: vivado.exe -gui_launcher_event rodinguilauncherevent21396 C:\Users\daido\Desktop\Polimi\Anno 4\DESD\Git\KittCarPWM\jstk2_interface\jstk2_interface.xpr
# Log file: C:/Users/daido/Desktop/Polimi/Anno 4/DESD/Git/KittCarPWM/jstk2_interface/vivado.log
# Journal file: C:/Users/daido/Desktop/Polimi/Anno 4/DESD/Git/KittCarPWM/jstk2_interface\vivado.jou
#-----------------------------------------------------------
start_gui
open_project {C:/Users/daido/Desktop/Polimi/Anno 4/DESD/Git/KittCarPWM/jstk2_interface/jstk2_interface.xpr}
INFO: [Project 1-313] Project file moved from 'C:/Users/daido/Desktop/Polimi/Anno 4/DESD/LAB2/jstk2_interface' since last save.
INFO: [filemgmt 56-1] IP Repository Path: Directory not found as 'C:/Users/daido/Desktop/Polimi/Anno 4/DESD/Git/IP/ip_repo'; using path 'C:/Users/daido/Desktop/Polimi/Anno 4/DESD/IP/ip_repo' instead.
Scanning sources...
Finished scanning sources
INFO: [IP_Flow 19-234] Refreshing IP repositories
INFO: [IP_Flow 19-1700] Loaded user IP repository 'c:/Users/daido/Desktop/Polimi/Anno 4/DESD/IP/ip_repo'.
INFO: [IP_Flow 19-2313] Loaded Vivado IP repository 'C:/Xilinx/Vivado/2020.2/data/ip'.
open_project: Time (s): cpu = 00:00:05 ; elapsed = 00:00:07 . Memory (MB): peak = 1006.875 ; gain = 0.000
update_compile_order -fileset sources_1
update_module_reference test_UART_packet_jstk_uart_bridge_0_0_1
INFO: [IP_Flow 19-5107] Inferred bus interface 'm_axis' of definition 'xilinx.com:interface:axis:1.0' (from Xilinx Repository).
INFO: [IP_Flow 19-5107] Inferred bus interface 's_axis' of definition 'xilinx.com:interface:axis:1.0' (from Xilinx Repository).
INFO: [IP_Flow 19-5107] Inferred bus interface 'aresetn' of definition 'xilinx.com:signal:reset:1.0' (from Xilinx Repository).
INFO: [IP_Flow 19-5107] Inferred bus interface 'aclk' of definition 'xilinx.com:signal:clock:1.0' (from Xilinx Repository).
INFO: [IP_Flow 19-4728] Bus Interface 'aresetn': Added interface parameter 'POLARITY' with value 'ACTIVE_LOW'.
INFO: [IP_Flow 19-4728] Bus Interface 'aclk': Added interface parameter 'ASSOCIATED_BUSIF' with value 'm_axis'.
INFO: [IP_Flow 19-4728] Bus Interface 'aclk': Added interface parameter 'ASSOCIATED_RESET' with value 'aresetn'.
INFO: [IP_Flow 19-234] Refreshing IP repositories
INFO: [IP_Flow 19-1700] Loaded user IP repository 'c:/Users/daido/Desktop/Polimi/Anno 4/DESD/IP/ip_repo'.
Reading block design file <C:/Users/daido/Desktop/Polimi/Anno 4/DESD/Git/KittCarPWM/jstk2_interface/jstk2_interface.srcs/sources_1/bd/test_UART_packet/test_UART_packet.bd>...
Adding component instance block -- xilinx.com:ip:proc_sys_reset:5.0 - proc_sys_reset_0
Adding component instance block -- DigiLAB:ip:AXI4Stream_UART:1.1 - AXI4Stream_UART_0
Adding component instance block -- DigiLAB:ip:axi4stream_spi_master:1.0 - axi4stream_spi_master_0
Adding component instance block -- xilinx.com:ip:clk_wiz:6.0 - clk_wiz_0
Adding component instance block -- xilinx.com:module_ref:jstk_uart_bridge_0:1.0 - jstk_uart_bridge_0_0
Adding component instance block -- xilinx.com:module_ref:digilent_jstk2:1.0 - digilent_jstk2_0
Successfully read diagram <test_UART_packet> from block design file <C:/Users/daido/Desktop/Polimi/Anno 4/DESD/Git/KittCarPWM/jstk2_interface/jstk2_interface.srcs/sources_1/bd/test_UART_packet/test_UART_packet.bd>
Upgrading 'C:/Users/daido/Desktop/Polimi/Anno 4/DESD/Git/KittCarPWM/jstk2_interface/jstk2_interface.srcs/sources_1/bd/test_UART_packet/test_UART_packet.bd'
INFO: [IP_Flow 19-1972] Upgraded test_UART_packet_jstk_uart_bridge_0_0_1 from jstk_uart_bridge_0_v1_0 1.0 to jstk_uart_bridge_0_v1_0 1.0
Wrote  : <C:\Users\daido\Desktop\Polimi\Anno 4\DESD\Git\KittCarPWM\jstk2_interface\jstk2_interface.srcs\sources_1\bd\test_UART_packet\test_UART_packet.bd> 
Wrote  : <C:/Users/daido/Desktop/Polimi/Anno 4/DESD/Git/KittCarPWM/jstk2_interface/jstk2_interface.srcs/sources_1/bd/test_UART_packet/ui/bd_38c5ed8c.ui> 
upgrade_ip: Time (s): cpu = 00:00:07 ; elapsed = 00:00:13 . Memory (MB): peak = 1006.875 ; gain = 0.000
update_module_reference: Time (s): cpu = 00:00:08 ; elapsed = 00:00:13 . Memory (MB): peak = 1006.875 ; gain = 0.000
update_module_reference test_UART_packet_digilent_jstk2_0_1
INFO: [IP_Flow 19-5107] Inferred bus interface 'm_axis' of definition 'xilinx.com:interface:axis:1.0' (from Xilinx Repository).
INFO: [IP_Flow 19-5107] Inferred bus interface 's_axis' of definition 'xilinx.com:interface:axis:1.0' (from Xilinx Repository).
INFO: [IP_Flow 19-5107] Inferred bus interface 'aresetn' of definition 'xilinx.com:signal:reset:1.0' (from Xilinx Repository).
INFO: [IP_Flow 19-5107] Inferred bus interface 'aclk' of definition 'xilinx.com:signal:clock:1.0' (from Xilinx Repository).
INFO: [IP_Flow 19-4728] Bus Interface 'aresetn': Added interface parameter 'POLARITY' with value 'ACTIVE_LOW'.
INFO: [IP_Flow 19-4728] Bus Interface 'aclk': Added interface parameter 'ASSOCIATED_BUSIF' with value 'm_axis'.
INFO: [IP_Flow 19-4728] Bus Interface 'aclk': Added interface parameter 'ASSOCIATED_RESET' with value 'aresetn'.
INFO: [IP_Flow 19-234] Refreshing IP repositories
INFO: [IP_Flow 19-1700] Loaded user IP repository 'c:/Users/daido/Desktop/Polimi/Anno 4/DESD/IP/ip_repo'.
Upgrading 'C:/Users/daido/Desktop/Polimi/Anno 4/DESD/Git/KittCarPWM/jstk2_interface/jstk2_interface.srcs/sources_1/bd/test_UART_packet/test_UART_packet.bd'
INFO: [IP_Flow 19-1972] Upgraded test_UART_packet_digilent_jstk2_0_1 from digilent_jstk2_v1_0 1.0 to digilent_jstk2_v1_0 1.0
Wrote  : <C:\Users\daido\Desktop\Polimi\Anno 4\DESD\Git\KittCarPWM\jstk2_interface\jstk2_interface.srcs\sources_1\bd\test_UART_packet\test_UART_packet.bd> 
Wrote  : <C:/Users/daido/Desktop/Polimi/Anno 4/DESD/Git/KittCarPWM/jstk2_interface/jstk2_interface.srcs/sources_1/bd/test_UART_packet/ui/bd_38c5ed8c.ui> 
reset_run synth_1
launch_runs synth_1 -jobs 6
INFO: [xilinx.com:ip:clk_wiz:6.0-1] /clk_wiz_0 clk_wiz propagate
WARNING: [BD 41-927] Following properties on pin /axi4stream_spi_master_0/aclk have been updated from connected ip, but BD cell '/axi4stream_spi_master_0' does not accept parameter changes, so they may not be synchronized with cell properties:
	PHASE = 0.0 
Please resolve any mismatches by directly setting properties on BD cell </axi4stream_spi_master_0> to completely resolve these warnings.
Wrote  : <C:\Users\daido\Desktop\Polimi\Anno 4\DESD\Git\KittCarPWM\jstk2_interface\jstk2_interface.srcs\sources_1\bd\test_UART_packet\test_UART_packet.bd> 
Wrote  : <C:/Users/daido/Desktop/Polimi/Anno 4/DESD/Git/KittCarPWM/jstk2_interface/jstk2_interface.srcs/sources_1/bd/test_UART_packet/ui/bd_38c5ed8c.ui> 
VHDL Output written to : c:/Users/daido/Desktop/Polimi/Anno 4/DESD/Git/KittCarPWM/jstk2_interface/jstk2_interface.gen/sources_1/bd/test_UART_packet/synth/test_UART_packet.vhd
VHDL Output written to : c:/Users/daido/Desktop/Polimi/Anno 4/DESD/Git/KittCarPWM/jstk2_interface/jstk2_interface.gen/sources_1/bd/test_UART_packet/sim/test_UART_packet.vhd
VHDL Output written to : c:/Users/daido/Desktop/Polimi/Anno 4/DESD/Git/KittCarPWM/jstk2_interface/jstk2_interface.gen/sources_1/bd/test_UART_packet/hdl/test_UART_packet_wrapper.vhd
Wrote  : <C:/Users/daido/Desktop/Polimi/Anno 4/DESD/Git/KittCarPWM/jstk2_interface/jstk2_interface.srcs/sources_1/bd/test_UART_packet/ui/bd_38c5ed8c.ui> 
INFO: [BD 41-1029] Generation completed for the IP Integrator block jstk_uart_bridge_0_0 .
INFO: [BD 41-1029] Generation completed for the IP Integrator block digilent_jstk2_0 .
Exporting to file c:/Users/daido/Desktop/Polimi/Anno 4/DESD/Git/KittCarPWM/jstk2_interface/jstk2_interface.gen/sources_1/bd/test_UART_packet/hw_handoff/test_UART_packet.hwh
Generated Block Design Tcl file c:/Users/daido/Desktop/Polimi/Anno 4/DESD/Git/KittCarPWM/jstk2_interface/jstk2_interface.gen/sources_1/bd/test_UART_packet/hw_handoff/test_UART_packet_bd.tcl
Generated Hardware Definition File c:/Users/daido/Desktop/Polimi/Anno 4/DESD/Git/KittCarPWM/jstk2_interface/jstk2_interface.gen/sources_1/bd/test_UART_packet/synth/test_UART_packet.hwdef
[Thu Apr 13 23:18:09 2023] Launched test_UART_packet_digilent_jstk2_0_1_synth_1, test_UART_packet_jstk_uart_bridge_0_0_1_synth_1...
Run output will be captured here:
test_UART_packet_digilent_jstk2_0_1_synth_1: C:/Users/daido/Desktop/Polimi/Anno 4/DESD/Git/KittCarPWM/jstk2_interface/jstk2_interface.runs/test_UART_packet_digilent_jstk2_0_1_synth_1/runme.log
test_UART_packet_jstk_uart_bridge_0_0_1_synth_1: C:/Users/daido/Desktop/Polimi/Anno 4/DESD/Git/KittCarPWM/jstk2_interface/jstk2_interface.runs/test_UART_packet_jstk_uart_bridge_0_0_1_synth_1/runme.log
[Thu Apr 13 23:18:09 2023] Launched synth_1...
Run output will be captured here: C:/Users/daido/Desktop/Polimi/Anno 4/DESD/Git/KittCarPWM/jstk2_interface/jstk2_interface.runs/synth_1/runme.log
launch_runs: Time (s): cpu = 00:00:02 ; elapsed = 00:00:12 . Memory (MB): peak = 1006.875 ; gain = 0.000
open_run synth_1 -name synth_1
Design is defaulting to impl run constrset: constrs_1
Design is defaulting to synth run part: xc7a35tcpg236-1
INFO: [Device 21-403] Loading part xc7a35tcpg236-1
INFO: [Project 1-454] Reading design checkpoint 'c:/Users/daido/Desktop/Polimi/Anno 4/DESD/Git/KittCarPWM/jstk2_interface/jstk2_interface.gen/sources_1/bd/test_UART_packet/ip/test_UART_packet_AXI4Stream_UART_0_1/test_UART_packet_AXI4Stream_UART_0_1.dcp' for cell 'test_UART_packet_i/AXI4Stream_UART_0'
INFO: [Project 1-454] Reading design checkpoint 'c:/Users/daido/Desktop/Polimi/Anno 4/DESD/Git/KittCarPWM/jstk2_interface/jstk2_interface.gen/sources_1/bd/test_UART_packet/ip/test_UART_packet_axi4stream_spi_master_0_1/test_UART_packet_axi4stream_spi_master_0_1.dcp' for cell 'test_UART_packet_i/axi4stream_spi_master_0'
INFO: [Project 1-454] Reading design checkpoint 'c:/Users/daido/Desktop/Polimi/Anno 4/DESD/Git/KittCarPWM/jstk2_interface/jstk2_interface.gen/sources_1/bd/test_UART_packet/ip/test_UART_packet_clk_wiz_0_2/test_UART_packet_clk_wiz_0_2.dcp' for cell 'test_UART_packet_i/clk_wiz_0'
INFO: [Project 1-454] Reading design checkpoint 'c:/Users/daido/Desktop/Polimi/Anno 4/DESD/Git/KittCarPWM/jstk2_interface/jstk2_interface.gen/sources_1/bd/test_UART_packet/ip/test_UART_packet_digilent_jstk2_0_1/test_UART_packet_digilent_jstk2_0_1.dcp' for cell 'test_UART_packet_i/digilent_jstk2_0'
INFO: [Project 1-454] Reading design checkpoint 'c:/Users/daido/Desktop/Polimi/Anno 4/DESD/Git/KittCarPWM/jstk2_interface/jstk2_interface.gen/sources_1/bd/test_UART_packet/ip/test_UART_packet_jstk_uart_bridge_0_0_1/test_UART_packet_jstk_uart_bridge_0_0_1.dcp' for cell 'test_UART_packet_i/jstk_uart_bridge_0_0'
INFO: [Project 1-454] Reading design checkpoint 'c:/Users/daido/Desktop/Polimi/Anno 4/DESD/Git/KittCarPWM/jstk2_interface/jstk2_interface.gen/sources_1/bd/test_UART_packet/ip/test_UART_packet_proc_sys_reset_0_1/test_UART_packet_proc_sys_reset_0_1.dcp' for cell 'test_UART_packet_i/proc_sys_reset_0'
Netlist sorting complete. Time (s): cpu = 00:00:00 ; elapsed = 00:00:00.013 . Memory (MB): peak = 1166.555 ; gain = 0.000
INFO: [Netlist 29-17] Analyzing 72 Unisim elements for replacement
INFO: [Netlist 29-28] Unisim Transformation completed in 0 CPU seconds
INFO: [Project 1-479] Netlist was created with Vivado 2020.2
INFO: [Project 1-570] Preparing netlist for logic optimization
Parsing XDC File [c:/Users/daido/Desktop/Polimi/Anno 4/DESD/Git/KittCarPWM/jstk2_interface/jstk2_interface.gen/sources_1/bd/test_UART_packet/ip/test_UART_packet_proc_sys_reset_0_1/test_UART_packet_proc_sys_reset_0_1_board.xdc] for cell 'test_UART_packet_i/proc_sys_reset_0/U0'
Finished Parsing XDC File [c:/Users/daido/Desktop/Polimi/Anno 4/DESD/Git/KittCarPWM/jstk2_interface/jstk2_interface.gen/sources_1/bd/test_UART_packet/ip/test_UART_packet_proc_sys_reset_0_1/test_UART_packet_proc_sys_reset_0_1_board.xdc] for cell 'test_UART_packet_i/proc_sys_reset_0/U0'
Parsing XDC File [c:/Users/daido/Desktop/Polimi/Anno 4/DESD/Git/KittCarPWM/jstk2_interface/jstk2_interface.gen/sources_1/bd/test_UART_packet/ip/test_UART_packet_proc_sys_reset_0_1/test_UART_packet_proc_sys_reset_0_1.xdc] for cell 'test_UART_packet_i/proc_sys_reset_0/U0'
Finished Parsing XDC File [c:/Users/daido/Desktop/Polimi/Anno 4/DESD/Git/KittCarPWM/jstk2_interface/jstk2_interface.gen/sources_1/bd/test_UART_packet/ip/test_UART_packet_proc_sys_reset_0_1/test_UART_packet_proc_sys_reset_0_1.xdc] for cell 'test_UART_packet_i/proc_sys_reset_0/U0'
Parsing XDC File [c:/Users/daido/Desktop/Polimi/Anno 4/DESD/Git/KittCarPWM/jstk2_interface/jstk2_interface.gen/sources_1/bd/test_UART_packet/ip/test_UART_packet_AXI4Stream_UART_0_1/test_UART_packet_AXI4Stream_UART_0_1_board.xdc] for cell 'test_UART_packet_i/AXI4Stream_UART_0/U0'
Finished Parsing XDC File [c:/Users/daido/Desktop/Polimi/Anno 4/DESD/Git/KittCarPWM/jstk2_interface/jstk2_interface.gen/sources_1/bd/test_UART_packet/ip/test_UART_packet_AXI4Stream_UART_0_1/test_UART_packet_AXI4Stream_UART_0_1_board.xdc] for cell 'test_UART_packet_i/AXI4Stream_UART_0/U0'
Parsing XDC File [c:/Users/daido/Desktop/Polimi/Anno 4/DESD/Git/KittCarPWM/jstk2_interface/jstk2_interface.gen/sources_1/bd/test_UART_packet/ip/test_UART_packet_clk_wiz_0_2/test_UART_packet_clk_wiz_0_2_board.xdc] for cell 'test_UART_packet_i/clk_wiz_0/inst'
Finished Parsing XDC File [c:/Users/daido/Desktop/Polimi/Anno 4/DESD/Git/KittCarPWM/jstk2_interface/jstk2_interface.gen/sources_1/bd/test_UART_packet/ip/test_UART_packet_clk_wiz_0_2/test_UART_packet_clk_wiz_0_2_board.xdc] for cell 'test_UART_packet_i/clk_wiz_0/inst'
Parsing XDC File [c:/Users/daido/Desktop/Polimi/Anno 4/DESD/Git/KittCarPWM/jstk2_interface/jstk2_interface.gen/sources_1/bd/test_UART_packet/ip/test_UART_packet_clk_wiz_0_2/test_UART_packet_clk_wiz_0_2.xdc] for cell 'test_UART_packet_i/clk_wiz_0/inst'
INFO: [Timing 38-35] Done setting XDC timing constraints. [c:/Users/daido/Desktop/Polimi/Anno 4/DESD/Git/KittCarPWM/jstk2_interface/jstk2_interface.gen/sources_1/bd/test_UART_packet/ip/test_UART_packet_clk_wiz_0_2/test_UART_packet_clk_wiz_0_2.xdc:57]
INFO: [Timing 38-2] Deriving generated clocks [c:/Users/daido/Desktop/Polimi/Anno 4/DESD/Git/KittCarPWM/jstk2_interface/jstk2_interface.gen/sources_1/bd/test_UART_packet/ip/test_UART_packet_clk_wiz_0_2/test_UART_packet_clk_wiz_0_2.xdc:57]
Finished Parsing XDC File [c:/Users/daido/Desktop/Polimi/Anno 4/DESD/Git/KittCarPWM/jstk2_interface/jstk2_interface.gen/sources_1/bd/test_UART_packet/ip/test_UART_packet_clk_wiz_0_2/test_UART_packet_clk_wiz_0_2.xdc] for cell 'test_UART_packet_i/clk_wiz_0/inst'
Parsing XDC File [C:/Users/daido/Desktop/Polimi/Anno 4/DESD/Git/KittCarPWM/jstk2_interface/jstk2_interface.srcs/constrs_1/new/PINS.xdc]
Finished Parsing XDC File [C:/Users/daido/Desktop/Polimi/Anno 4/DESD/Git/KittCarPWM/jstk2_interface/jstk2_interface.srcs/constrs_1/new/PINS.xdc]
WARNING: [XPM_CDC_GRAY: TCL-1000] The source and destination clocks are the same. 
     Instance: test_UART_packet_i/AXI4Stream_UART_0/U0/FIFO_DATA_RX/gnuram_async_fifo.xpm_fifo_base_inst/gen_cdc_pntr.rd_pntr_cdc_inst 
  This will add unnecessary latency to the design. Please check the design for the following: 
 1) Manually instantiated XPM_CDC modules: Xilinx recommends that you remove these modules. 
 2) Xilinx IP that contains XPM_CDC modules: Verify the connections to the IP to determine whether you can safely ignore this message.
 [C:/Xilinx/Vivado/2020.2/data/ip/xpm/xpm_cdc/tcl/xpm_cdc_gray.tcl:16]
WARNING: [XPM_CDC_GRAY: TCL-1000] The source and destination clocks are the same. 
     Instance: test_UART_packet_i/AXI4Stream_UART_0/U0/FIFO_DATA_TX/gnuram_async_fifo.xpm_fifo_base_inst/gen_cdc_pntr.wr_pntr_cdc_inst 
  This will add unnecessary latency to the design. Please check the design for the following: 
 1) Manually instantiated XPM_CDC modules: Xilinx recommends that you remove these modules. 
 2) Xilinx IP that contains XPM_CDC modules: Verify the connections to the IP to determine whether you can safely ignore this message.
 [C:/Xilinx/Vivado/2020.2/data/ip/xpm/xpm_cdc/tcl/xpm_cdc_gray.tcl:16]
WARNING: [XPM_CDC_GRAY: TCL-1000] The source and destination clocks are the same. 
     Instance: test_UART_packet_i/AXI4Stream_UART_0/U0/FIFO_DATA_TX/gnuram_async_fifo.xpm_fifo_base_inst/gen_cdc_pntr.rd_pntr_cdc_inst 
  This will add unnecessary latency to the design. Please check the design for the following: 
 1) Manually instantiated XPM_CDC modules: Xilinx recommends that you remove these modules. 
 2) Xilinx IP that contains XPM_CDC modules: Verify the connections to the IP to determine whether you can safely ignore this message.
 [C:/Xilinx/Vivado/2020.2/data/ip/xpm/xpm_cdc/tcl/xpm_cdc_gray.tcl:16]
WARNING: [XPM_CDC_GRAY: TCL-1000] The source and destination clocks are the same. 
     Instance: test_UART_packet_i/AXI4Stream_UART_0/U0/FIFO_DATA_RX/gnuram_async_fifo.xpm_fifo_base_inst/gen_cdc_pntr.wr_pntr_cdc_inst 
  This will add unnecessary latency to the design. Please check the design for the following: 
 1) Manually instantiated XPM_CDC modules: Xilinx recommends that you remove these modules. 
 2) Xilinx IP that contains XPM_CDC modules: Verify the connections to the IP to determine whether you can safely ignore this message.
 [C:/Xilinx/Vivado/2020.2/data/ip/xpm/xpm_cdc/tcl/xpm_cdc_gray.tcl:16]
WARNING: [XPM_CDC_GRAY: TCL-1000] The source and destination clocks are the same. 
     Instance: test_UART_packet_i/AXI4Stream_UART_0/U0/FIFO_DATA_RX/gnuram_async_fifo.xpm_fifo_base_inst/gen_cdc_pntr.wr_pntr_cdc_dc_inst 
  This will add unnecessary latency to the design. Please check the design for the following: 
 1) Manually instantiated XPM_CDC modules: Xilinx recommends that you remove these modules. 
 2) Xilinx IP that contains XPM_CDC modules: Verify the connections to the IP to determine whether you can safely ignore this message.
 [C:/Xilinx/Vivado/2020.2/data/ip/xpm/xpm_cdc/tcl/xpm_cdc_gray.tcl:16]
WARNING: [XPM_CDC_GRAY: TCL-1000] The source and destination clocks are the same. 
     Instance: test_UART_packet_i/AXI4Stream_UART_0/U0/FIFO_DATA_TX/gnuram_async_fifo.xpm_fifo_base_inst/gen_cdc_pntr.wr_pntr_cdc_dc_inst 
  This will add unnecessary latency to the design. Please check the design for the following: 
 1) Manually instantiated XPM_CDC modules: Xilinx recommends that you remove these modules. 
 2) Xilinx IP that contains XPM_CDC modules: Verify the connections to the IP to determine whether you can safely ignore this message.
 [C:/Xilinx/Vivado/2020.2/data/ip/xpm/xpm_cdc/tcl/xpm_cdc_gray.tcl:16]
WARNING: [XPM_CDC_GRAY: TCL-1000] The source and destination clocks are the same. 
     Instance: test_UART_packet_i/AXI4Stream_UART_0/U0/FIFO_DATA_RX/gnuram_async_fifo.xpm_fifo_base_inst/gen_cdc_pntr.rd_pntr_cdc_dc_inst 
  This will add unnecessary latency to the design. Please check the design for the following: 
 1) Manually instantiated XPM_CDC modules: Xilinx recommends that you remove these modules. 
 2) Xilinx IP that contains XPM_CDC modules: Verify the connections to the IP to determine whether you can safely ignore this message.
 [C:/Xilinx/Vivado/2020.2/data/ip/xpm/xpm_cdc/tcl/xpm_cdc_gray.tcl:16]
WARNING: [XPM_CDC_GRAY: TCL-1000] The source and destination clocks are the same. 
     Instance: test_UART_packet_i/AXI4Stream_UART_0/U0/FIFO_DATA_TX/gnuram_async_fifo.xpm_fifo_base_inst/gen_cdc_pntr.rd_pntr_cdc_dc_inst 
  This will add unnecessary latency to the design. Please check the design for the following: 
 1) Manually instantiated XPM_CDC modules: Xilinx recommends that you remove these modules. 
 2) Xilinx IP that contains XPM_CDC modules: Verify the connections to the IP to determine whether you can safely ignore this message.
 [C:/Xilinx/Vivado/2020.2/data/ip/xpm/xpm_cdc/tcl/xpm_cdc_gray.tcl:16]
INFO: [Project 1-1715] 3 XPM XDC files have been applied to the design.
INFO: [Opt 31-138] Pushed 0 inverter(s) to 0 load pin(s).
Netlist sorting complete. Time (s): cpu = 00:00:00 ; elapsed = 00:00:00.001 . Memory (MB): peak = 1858.184 ; gain = 0.000
INFO: [Project 1-111] Unisim Transformation Summary:
  A total of 4 instances were transformed.
  IOBUF => IOBUF (IBUF, OBUFT): 4 instances

open_run: Time (s): cpu = 00:00:15 ; elapsed = 00:00:18 . Memory (MB): peak = 1885.676 ; gain = 860.367
open_bd_design {C:/Users/daido/Desktop/Polimi/Anno 4/DESD/Git/KittCarPWM/jstk2_interface/jstk2_interface.srcs/sources_1/bd/test_UART_packet/test_UART_packet.bd}
update_module_reference test_UART_packet_digilent_jstk2_0_1
INFO: [IP_Flow 19-5107] Inferred bus interface 'm_axis' of definition 'xilinx.com:interface:axis:1.0' (from Xilinx Repository).
INFO: [IP_Flow 19-5107] Inferred bus interface 's_axis' of definition 'xilinx.com:interface:axis:1.0' (from Xilinx Repository).
INFO: [IP_Flow 19-5107] Inferred bus interface 'aresetn' of definition 'xilinx.com:signal:reset:1.0' (from Xilinx Repository).
INFO: [IP_Flow 19-5107] Inferred bus interface 'aclk' of definition 'xilinx.com:signal:clock:1.0' (from Xilinx Repository).
INFO: [IP_Flow 19-4728] Bus Interface 'aresetn': Added interface parameter 'POLARITY' with value 'ACTIVE_LOW'.
INFO: [IP_Flow 19-4728] Bus Interface 'aclk': Added interface parameter 'ASSOCIATED_BUSIF' with value 'm_axis'.
INFO: [IP_Flow 19-4728] Bus Interface 'aclk': Added interface parameter 'ASSOCIATED_RESET' with value 'aresetn'.
INFO: [IP_Flow 19-234] Refreshing IP repositories
INFO: [IP_Flow 19-1700] Loaded user IP repository 'c:/Users/daido/Desktop/Polimi/Anno 4/DESD/IP/ip_repo'.
Upgrading 'C:/Users/daido/Desktop/Polimi/Anno 4/DESD/Git/KittCarPWM/jstk2_interface/jstk2_interface.srcs/sources_1/bd/test_UART_packet/test_UART_packet.bd'
WARNING: [Vivado 12-1017] Problems encountered:
1. Failed to delete one or more files in run directory C:/Users/daido/Desktop/Polimi/Anno 4/DESD/Git/KittCarPWM/jstk2_interface/jstk2_interface.runs/test_UART_packet_digilent_jstk2_0_1_synth_1

INFO: [IP_Flow 19-1972] Upgraded test_UART_packet_digilent_jstk2_0_1 from digilent_jstk2_v1_0 1.0 to digilent_jstk2_v1_0 1.0
Wrote  : <C:\Users\daido\Desktop\Polimi\Anno 4\DESD\Git\KittCarPWM\jstk2_interface\jstk2_interface.srcs\sources_1\bd\test_UART_packet\test_UART_packet.bd> 
Wrote  : <C:/Users/daido/Desktop/Polimi/Anno 4/DESD/Git/KittCarPWM/jstk2_interface/jstk2_interface.srcs/sources_1/bd/test_UART_packet/ui/bd_38c5ed8c.ui> 
reset_run synth_1
WARNING: [Vivado 12-1017] Problems encountered:
1. Failed to delete one or more files in run directory C:/Users/daido/Desktop/Polimi/Anno 4/DESD/Git/KittCarPWM/jstk2_interface/jstk2_interface.runs/synth_1

launch_runs synth_1 -jobs 6
INFO: [xilinx.com:ip:clk_wiz:6.0-1] /clk_wiz_0 clk_wiz propagate
WARNING: [BD 41-927] Following properties on pin /axi4stream_spi_master_0/aclk have been updated from connected ip, but BD cell '/axi4stream_spi_master_0' does not accept parameter changes, so they may not be synchronized with cell properties:
	PHASE = 0.0 
Please resolve any mismatches by directly setting properties on BD cell </axi4stream_spi_master_0> to completely resolve these warnings.
Wrote  : <C:\Users\daido\Desktop\Polimi\Anno 4\DESD\Git\KittCarPWM\jstk2_interface\jstk2_interface.srcs\sources_1\bd\test_UART_packet\test_UART_packet.bd> 
VHDL Output written to : c:/Users/daido/Desktop/Polimi/Anno 4/DESD/Git/KittCarPWM/jstk2_interface/jstk2_interface.gen/sources_1/bd/test_UART_packet/synth/test_UART_packet.vhd
VHDL Output written to : c:/Users/daido/Desktop/Polimi/Anno 4/DESD/Git/KittCarPWM/jstk2_interface/jstk2_interface.gen/sources_1/bd/test_UART_packet/sim/test_UART_packet.vhd
VHDL Output written to : c:/Users/daido/Desktop/Polimi/Anno 4/DESD/Git/KittCarPWM/jstk2_interface/jstk2_interface.gen/sources_1/bd/test_UART_packet/hdl/test_UART_packet_wrapper.vhd
INFO: [BD 41-1029] Generation completed for the IP Integrator block digilent_jstk2_0 .
Exporting to file c:/Users/daido/Desktop/Polimi/Anno 4/DESD/Git/KittCarPWM/jstk2_interface/jstk2_interface.gen/sources_1/bd/test_UART_packet/hw_handoff/test_UART_packet.hwh
Generated Block Design Tcl file c:/Users/daido/Desktop/Polimi/Anno 4/DESD/Git/KittCarPWM/jstk2_interface/jstk2_interface.gen/sources_1/bd/test_UART_packet/hw_handoff/test_UART_packet_bd.tcl
Generated Hardware Definition File c:/Users/daido/Desktop/Polimi/Anno 4/DESD/Git/KittCarPWM/jstk2_interface/jstk2_interface.gen/sources_1/bd/test_UART_packet/synth/test_UART_packet.hwdef
[Thu Apr 13 23:23:28 2023] Launched test_UART_packet_digilent_jstk2_0_1_synth_1...
Run output will be captured here: C:/Users/daido/Desktop/Polimi/Anno 4/DESD/Git/KittCarPWM/jstk2_interface/jstk2_interface.runs/test_UART_packet_digilent_jstk2_0_1_synth_1/runme.log
[Thu Apr 13 23:23:28 2023] Launched synth_1...
Run output will be captured here: C:/Users/daido/Desktop/Polimi/Anno 4/DESD/Git/KittCarPWM/jstk2_interface/jstk2_interface.runs/synth_1/runme.log
close_design
open_run synth_1 -name synth_1
Design is defaulting to impl run constrset: constrs_1
Design is defaulting to synth run part: xc7a35tcpg236-1
INFO: [Project 1-454] Reading design checkpoint 'c:/Users/daido/Desktop/Polimi/Anno 4/DESD/Git/KittCarPWM/jstk2_interface/jstk2_interface.gen/sources_1/bd/test_UART_packet/ip/test_UART_packet_AXI4Stream_UART_0_1/test_UART_packet_AXI4Stream_UART_0_1.dcp' for cell 'test_UART_packet_i/AXI4Stream_UART_0'
INFO: [Project 1-454] Reading design checkpoint 'c:/Users/daido/Desktop/Polimi/Anno 4/DESD/Git/KittCarPWM/jstk2_interface/jstk2_interface.gen/sources_1/bd/test_UART_packet/ip/test_UART_packet_axi4stream_spi_master_0_1/test_UART_packet_axi4stream_spi_master_0_1.dcp' for cell 'test_UART_packet_i/axi4stream_spi_master_0'
INFO: [Project 1-454] Reading design checkpoint 'c:/Users/daido/Desktop/Polimi/Anno 4/DESD/Git/KittCarPWM/jstk2_interface/jstk2_interface.gen/sources_1/bd/test_UART_packet/ip/test_UART_packet_clk_wiz_0_2/test_UART_packet_clk_wiz_0_2.dcp' for cell 'test_UART_packet_i/clk_wiz_0'
INFO: [Project 1-454] Reading design checkpoint 'c:/Users/daido/Desktop/Polimi/Anno 4/DESD/Git/KittCarPWM/jstk2_interface/jstk2_interface.gen/sources_1/bd/test_UART_packet/ip/test_UART_packet_digilent_jstk2_0_1/test_UART_packet_digilent_jstk2_0_1.dcp' for cell 'test_UART_packet_i/digilent_jstk2_0'
INFO: [Project 1-454] Reading design checkpoint 'c:/Users/daido/Desktop/Polimi/Anno 4/DESD/Git/KittCarPWM/jstk2_interface/jstk2_interface.gen/sources_1/bd/test_UART_packet/ip/test_UART_packet_jstk_uart_bridge_0_0_1/test_UART_packet_jstk_uart_bridge_0_0_1.dcp' for cell 'test_UART_packet_i/jstk_uart_bridge_0_0'
INFO: [Project 1-454] Reading design checkpoint 'c:/Users/daido/Desktop/Polimi/Anno 4/DESD/Git/KittCarPWM/jstk2_interface/jstk2_interface.gen/sources_1/bd/test_UART_packet/ip/test_UART_packet_proc_sys_reset_0_1/test_UART_packet_proc_sys_reset_0_1.dcp' for cell 'test_UART_packet_i/proc_sys_reset_0'
Netlist sorting complete. Time (s): cpu = 00:00:00 ; elapsed = 00:00:00.013 . Memory (MB): peak = 1934.348 ; gain = 0.000
INFO: [Netlist 29-17] Analyzing 72 Unisim elements for replacement
INFO: [Netlist 29-28] Unisim Transformation completed in 0 CPU seconds
INFO: [Project 1-479] Netlist was created with Vivado 2020.2
INFO: [Project 1-570] Preparing netlist for logic optimization
Parsing XDC File [c:/Users/daido/Desktop/Polimi/Anno 4/DESD/Git/KittCarPWM/jstk2_interface/jstk2_interface.gen/sources_1/bd/test_UART_packet/ip/test_UART_packet_proc_sys_reset_0_1/test_UART_packet_proc_sys_reset_0_1_board.xdc] for cell 'test_UART_packet_i/proc_sys_reset_0/U0'
Finished Parsing XDC File [c:/Users/daido/Desktop/Polimi/Anno 4/DESD/Git/KittCarPWM/jstk2_interface/jstk2_interface.gen/sources_1/bd/test_UART_packet/ip/test_UART_packet_proc_sys_reset_0_1/test_UART_packet_proc_sys_reset_0_1_board.xdc] for cell 'test_UART_packet_i/proc_sys_reset_0/U0'
Parsing XDC File [c:/Users/daido/Desktop/Polimi/Anno 4/DESD/Git/KittCarPWM/jstk2_interface/jstk2_interface.gen/sources_1/bd/test_UART_packet/ip/test_UART_packet_proc_sys_reset_0_1/test_UART_packet_proc_sys_reset_0_1.xdc] for cell 'test_UART_packet_i/proc_sys_reset_0/U0'
Finished Parsing XDC File [c:/Users/daido/Desktop/Polimi/Anno 4/DESD/Git/KittCarPWM/jstk2_interface/jstk2_interface.gen/sources_1/bd/test_UART_packet/ip/test_UART_packet_proc_sys_reset_0_1/test_UART_packet_proc_sys_reset_0_1.xdc] for cell 'test_UART_packet_i/proc_sys_reset_0/U0'
Parsing XDC File [c:/Users/daido/Desktop/Polimi/Anno 4/DESD/Git/KittCarPWM/jstk2_interface/jstk2_interface.gen/sources_1/bd/test_UART_packet/ip/test_UART_packet_AXI4Stream_UART_0_1/test_UART_packet_AXI4Stream_UART_0_1_board.xdc] for cell 'test_UART_packet_i/AXI4Stream_UART_0/U0'
Finished Parsing XDC File [c:/Users/daido/Desktop/Polimi/Anno 4/DESD/Git/KittCarPWM/jstk2_interface/jstk2_interface.gen/sources_1/bd/test_UART_packet/ip/test_UART_packet_AXI4Stream_UART_0_1/test_UART_packet_AXI4Stream_UART_0_1_board.xdc] for cell 'test_UART_packet_i/AXI4Stream_UART_0/U0'
Parsing XDC File [c:/Users/daido/Desktop/Polimi/Anno 4/DESD/Git/KittCarPWM/jstk2_interface/jstk2_interface.gen/sources_1/bd/test_UART_packet/ip/test_UART_packet_clk_wiz_0_2/test_UART_packet_clk_wiz_0_2_board.xdc] for cell 'test_UART_packet_i/clk_wiz_0/inst'
Finished Parsing XDC File [c:/Users/daido/Desktop/Polimi/Anno 4/DESD/Git/KittCarPWM/jstk2_interface/jstk2_interface.gen/sources_1/bd/test_UART_packet/ip/test_UART_packet_clk_wiz_0_2/test_UART_packet_clk_wiz_0_2_board.xdc] for cell 'test_UART_packet_i/clk_wiz_0/inst'
Parsing XDC File [c:/Users/daido/Desktop/Polimi/Anno 4/DESD/Git/KittCarPWM/jstk2_interface/jstk2_interface.gen/sources_1/bd/test_UART_packet/ip/test_UART_packet_clk_wiz_0_2/test_UART_packet_clk_wiz_0_2.xdc] for cell 'test_UART_packet_i/clk_wiz_0/inst'
INFO: [Timing 38-35] Done setting XDC timing constraints. [c:/Users/daido/Desktop/Polimi/Anno 4/DESD/Git/KittCarPWM/jstk2_interface/jstk2_interface.gen/sources_1/bd/test_UART_packet/ip/test_UART_packet_clk_wiz_0_2/test_UART_packet_clk_wiz_0_2.xdc:57]
INFO: [Timing 38-2] Deriving generated clocks [c:/Users/daido/Desktop/Polimi/Anno 4/DESD/Git/KittCarPWM/jstk2_interface/jstk2_interface.gen/sources_1/bd/test_UART_packet/ip/test_UART_packet_clk_wiz_0_2/test_UART_packet_clk_wiz_0_2.xdc:57]
Finished Parsing XDC File [c:/Users/daido/Desktop/Polimi/Anno 4/DESD/Git/KittCarPWM/jstk2_interface/jstk2_interface.gen/sources_1/bd/test_UART_packet/ip/test_UART_packet_clk_wiz_0_2/test_UART_packet_clk_wiz_0_2.xdc] for cell 'test_UART_packet_i/clk_wiz_0/inst'
Parsing XDC File [C:/Users/daido/Desktop/Polimi/Anno 4/DESD/Git/KittCarPWM/jstk2_interface/jstk2_interface.srcs/constrs_1/new/PINS.xdc]
Finished Parsing XDC File [C:/Users/daido/Desktop/Polimi/Anno 4/DESD/Git/KittCarPWM/jstk2_interface/jstk2_interface.srcs/constrs_1/new/PINS.xdc]
WARNING: [XPM_CDC_GRAY: TCL-1000] The source and destination clocks are the same. 
     Instance: test_UART_packet_i/AXI4Stream_UART_0/U0/FIFO_DATA_RX/gnuram_async_fifo.xpm_fifo_base_inst/gen_cdc_pntr.rd_pntr_cdc_inst 
  This will add unnecessary latency to the design. Please check the design for the following: 
 1) Manually instantiated XPM_CDC modules: Xilinx recommends that you remove these modules. 
 2) Xilinx IP that contains XPM_CDC modules: Verify the connections to the IP to determine whether you can safely ignore this message.
 [C:/Xilinx/Vivado/2020.2/data/ip/xpm/xpm_cdc/tcl/xpm_cdc_gray.tcl:16]
WARNING: [XPM_CDC_GRAY: TCL-1000] The source and destination clocks are the same. 
     Instance: test_UART_packet_i/AXI4Stream_UART_0/U0/FIFO_DATA_TX/gnuram_async_fifo.xpm_fifo_base_inst/gen_cdc_pntr.wr_pntr_cdc_inst 
  This will add unnecessary latency to the design. Please check the design for the following: 
 1) Manually instantiated XPM_CDC modules: Xilinx recommends that you remove these modules. 
 2) Xilinx IP that contains XPM_CDC modules: Verify the connections to the IP to determine whether you can safely ignore this message.
 [C:/Xilinx/Vivado/2020.2/data/ip/xpm/xpm_cdc/tcl/xpm_cdc_gray.tcl:16]
WARNING: [XPM_CDC_GRAY: TCL-1000] The source and destination clocks are the same. 
     Instance: test_UART_packet_i/AXI4Stream_UART_0/U0/FIFO_DATA_TX/gnuram_async_fifo.xpm_fifo_base_inst/gen_cdc_pntr.rd_pntr_cdc_inst 
  This will add unnecessary latency to the design. Please check the design for the following: 
 1) Manually instantiated XPM_CDC modules: Xilinx recommends that you remove these modules. 
 2) Xilinx IP that contains XPM_CDC modules: Verify the connections to the IP to determine whether you can safely ignore this message.
 [C:/Xilinx/Vivado/2020.2/data/ip/xpm/xpm_cdc/tcl/xpm_cdc_gray.tcl:16]
WARNING: [XPM_CDC_GRAY: TCL-1000] The source and destination clocks are the same. 
     Instance: test_UART_packet_i/AXI4Stream_UART_0/U0/FIFO_DATA_RX/gnuram_async_fifo.xpm_fifo_base_inst/gen_cdc_pntr.wr_pntr_cdc_inst 
  This will add unnecessary latency to the design. Please check the design for the following: 
 1) Manually instantiated XPM_CDC modules: Xilinx recommends that you remove these modules. 
 2) Xilinx IP that contains XPM_CDC modules: Verify the connections to the IP to determine whether you can safely ignore this message.
 [C:/Xilinx/Vivado/2020.2/data/ip/xpm/xpm_cdc/tcl/xpm_cdc_gray.tcl:16]
WARNING: [XPM_CDC_GRAY: TCL-1000] The source and destination clocks are the same. 
     Instance: test_UART_packet_i/AXI4Stream_UART_0/U0/FIFO_DATA_RX/gnuram_async_fifo.xpm_fifo_base_inst/gen_cdc_pntr.wr_pntr_cdc_dc_inst 
  This will add unnecessary latency to the design. Please check the design for the following: 
 1) Manually instantiated XPM_CDC modules: Xilinx recommends that you remove these modules. 
 2) Xilinx IP that contains XPM_CDC modules: Verify the connections to the IP to determine whether you can safely ignore this message.
 [C:/Xilinx/Vivado/2020.2/data/ip/xpm/xpm_cdc/tcl/xpm_cdc_gray.tcl:16]
WARNING: [XPM_CDC_GRAY: TCL-1000] The source and destination clocks are the same. 
     Instance: test_UART_packet_i/AXI4Stream_UART_0/U0/FIFO_DATA_TX/gnuram_async_fifo.xpm_fifo_base_inst/gen_cdc_pntr.wr_pntr_cdc_dc_inst 
  This will add unnecessary latency to the design. Please check the design for the following: 
 1) Manually instantiated XPM_CDC modules: Xilinx recommends that you remove these modules. 
 2) Xilinx IP that contains XPM_CDC modules: Verify the connections to the IP to determine whether you can safely ignore this message.
 [C:/Xilinx/Vivado/2020.2/data/ip/xpm/xpm_cdc/tcl/xpm_cdc_gray.tcl:16]
WARNING: [XPM_CDC_GRAY: TCL-1000] The source and destination clocks are the same. 
     Instance: test_UART_packet_i/AXI4Stream_UART_0/U0/FIFO_DATA_RX/gnuram_async_fifo.xpm_fifo_base_inst/gen_cdc_pntr.rd_pntr_cdc_dc_inst 
  This will add unnecessary latency to the design. Please check the design for the following: 
 1) Manually instantiated XPM_CDC modules: Xilinx recommends that you remove these modules. 
 2) Xilinx IP that contains XPM_CDC modules: Verify the connections to the IP to determine whether you can safely ignore this message.
 [C:/Xilinx/Vivado/2020.2/data/ip/xpm/xpm_cdc/tcl/xpm_cdc_gray.tcl:16]
WARNING: [XPM_CDC_GRAY: TCL-1000] The source and destination clocks are the same. 
     Instance: test_UART_packet_i/AXI4Stream_UART_0/U0/FIFO_DATA_TX/gnuram_async_fifo.xpm_fifo_base_inst/gen_cdc_pntr.rd_pntr_cdc_dc_inst 
  This will add unnecessary latency to the design. Please check the design for the following: 
 1) Manually instantiated XPM_CDC modules: Xilinx recommends that you remove these modules. 
 2) Xilinx IP that contains XPM_CDC modules: Verify the connections to the IP to determine whether you can safely ignore this message.
 [C:/Xilinx/Vivado/2020.2/data/ip/xpm/xpm_cdc/tcl/xpm_cdc_gray.tcl:16]
INFO: [Project 1-1715] 3 XPM XDC files have been applied to the design.
INFO: [Opt 31-138] Pushed 0 inverter(s) to 0 load pin(s).
Netlist sorting complete. Time (s): cpu = 00:00:00 ; elapsed = 00:00:00.001 . Memory (MB): peak = 1973.160 ; gain = 0.000
INFO: [Project 1-111] Unisim Transformation Summary:
  A total of 4 instances were transformed.
  IOBUF => IOBUF (IBUF, OBUFT): 4 instances

launch_runs impl_1 -to_step write_bitstream -jobs 6
INFO: [Timing 38-480] Writing timing data to binary archive.
Writing placer database...
Writing XDEF routing.
Writing XDEF routing logical nets.
Writing XDEF routing special nets.
Write XDEF Complete: Time (s): cpu = 00:00:00 ; elapsed = 00:00:00.039 . Memory (MB): peak = 1973.160 ; gain = 0.000
ERROR: [Common 17-158] 'file' can only be specified once.
[Thu Apr 13 23:25:51 2023] Launched impl_1...
Run output will be captured here: C:/Users/daido/Desktop/Polimi/Anno 4/DESD/Git/KittCarPWM/jstk2_interface/jstk2_interface.runs/impl_1/runme.log
open_hw_manager
connect_hw_server -allow_non_jtag
INFO: [Labtools 27-2285] Connecting to hw_server url TCP:localhost:3121
INFO: [Labtools 27-2222] Launching hw_server...
INFO: [Labtools 27-2221] Launch Output:

****** Xilinx hw_server v2020.2
  **** Build date : Nov 18 2020 at 10:01:48
    ** Copyright 1986-2020 Xilinx, Inc. All Rights Reserved.

Warning: Cannot create '3000:arm' GDB server: Tentativo di accesso al socket con modalità non consentite dalle rispettive autorizzazioni di accesso

INFO: [Labtools 27-3415] Connecting to cs_server url TCP:localhost:3042
INFO: [Labtools 27-3417] Launching cs_server...
INFO: [Labtools 27-2221] Launch Output:


******** Xilinx cs_server v2020.2
  ****** Build date   : Nov 03 2020-22:02:56
    **** Build number : 2020.2.1604437376
      ** Copyright 2017-2020 Xilinx, Inc. All Rights Reserved.



connect_hw_server: Time (s): cpu = 00:00:00 ; elapsed = 00:00:09 . Memory (MB): peak = 1973.160 ; gain = 0.000
open_hw_target
INFO: [Labtoolstcl 44-466] Opening hw_target localhost:3121/xilinx_tcf/Digilent/210183AB4CF5A
open_hw_target: Time (s): cpu = 00:00:04 ; elapsed = 00:00:05 . Memory (MB): peak = 3498.375 ; gain = 1525.215
set_property PROGRAM.FILE {C:/Users/daido/Desktop/Polimi/Anno 4/DESD/Git/KittCarPWM/jstk2_interface/jstk2_interface.runs/impl_1/test_UART_packet_wrapper.bit} [get_hw_devices xc7a35t_0]
current_hw_device [get_hw_devices xc7a35t_0]
refresh_hw_device -update_hw_probes false [lindex [get_hw_devices xc7a35t_0] 0]
INFO: [Labtools 27-1435] Device xc7a35t (JTAG device index = 0) is not programmed (DONE status = 0).
set_property PROBES.FILE {} [get_hw_devices xc7a35t_0]
set_property FULL_PROBES.FILE {} [get_hw_devices xc7a35t_0]
set_property PROGRAM.FILE {C:/Users/daido/Desktop/Polimi/Anno 4/DESD/Git/KittCarPWM/jstk2_interface/jstk2_interface.runs/impl_1/test_UART_packet_wrapper.bit} [get_hw_devices xc7a35t_0]
program_hw_devices [get_hw_devices xc7a35t_0]
INFO: [Labtools 27-3164] End of startup status: HIGH
refresh_hw_device [lindex [get_hw_devices xc7a35t_0] 0]
INFO: [Labtools 27-1434] Device xc7a35t (JTAG device index = 0) is programmed with a design that has no supported debug core(s) in it.
open_bd_design {C:/Users/daido/Desktop/Polimi/Anno 4/DESD/Git/KittCarPWM/jstk2_interface/jstk2_interface.srcs/sources_1/bd/test_UART_packet/test_UART_packet.bd}
update_module_reference test_UART_packet_digilent_jstk2_0_1
INFO: [IP_Flow 19-5107] Inferred bus interface 'm_axis' of definition 'xilinx.com:interface:axis:1.0' (from Xilinx Repository).
INFO: [IP_Flow 19-5107] Inferred bus interface 's_axis' of definition 'xilinx.com:interface:axis:1.0' (from Xilinx Repository).
INFO: [IP_Flow 19-5107] Inferred bus interface 'aresetn' of definition 'xilinx.com:signal:reset:1.0' (from Xilinx Repository).
INFO: [IP_Flow 19-5107] Inferred bus interface 'aclk' of definition 'xilinx.com:signal:clock:1.0' (from Xilinx Repository).
INFO: [IP_Flow 19-4728] Bus Interface 'aresetn': Added interface parameter 'POLARITY' with value 'ACTIVE_LOW'.
INFO: [IP_Flow 19-4728] Bus Interface 'aclk': Added interface parameter 'ASSOCIATED_BUSIF' with value 'm_axis'.
INFO: [IP_Flow 19-4728] Bus Interface 'aclk': Added interface parameter 'ASSOCIATED_RESET' with value 'aresetn'.
INFO: [IP_Flow 19-234] Refreshing IP repositories
INFO: [IP_Flow 19-1700] Loaded user IP repository 'c:/Users/daido/Desktop/Polimi/Anno 4/DESD/IP/ip_repo'.
Upgrading 'C:/Users/daido/Desktop/Polimi/Anno 4/DESD/Git/KittCarPWM/jstk2_interface/jstk2_interface.srcs/sources_1/bd/test_UART_packet/test_UART_packet.bd'
WARNING: [Vivado 12-1017] Problems encountered:
1. Failed to delete one or more files in run directory C:/Users/daido/Desktop/Polimi/Anno 4/DESD/Git/KittCarPWM/jstk2_interface/jstk2_interface.runs/test_UART_packet_digilent_jstk2_0_1_synth_1

INFO: [IP_Flow 19-1972] Upgraded test_UART_packet_digilent_jstk2_0_1 from digilent_jstk2_v1_0 1.0 to digilent_jstk2_v1_0 1.0
Wrote  : <C:\Users\daido\Desktop\Polimi\Anno 4\DESD\Git\KittCarPWM\jstk2_interface\jstk2_interface.srcs\sources_1\bd\test_UART_packet\test_UART_packet.bd> 
Wrote  : <C:/Users/daido/Desktop/Polimi/Anno 4/DESD/Git/KittCarPWM/jstk2_interface/jstk2_interface.srcs/sources_1/bd/test_UART_packet/ui/bd_38c5ed8c.ui> 
reset_run synth_1
WARNING: [Vivado 12-1017] Problems encountered:
1. Failed to delete one or more files in run directory C:/Users/daido/Desktop/Polimi/Anno 4/DESD/Git/KittCarPWM/jstk2_interface/jstk2_interface.runs/synth_1

launch_runs synth_1 -jobs 6
INFO: [xilinx.com:ip:clk_wiz:6.0-1] /clk_wiz_0 clk_wiz propagate
WARNING: [BD 41-927] Following properties on pin /axi4stream_spi_master_0/aclk have been updated from connected ip, but BD cell '/axi4stream_spi_master_0' does not accept parameter changes, so they may not be synchronized with cell properties:
	PHASE = 0.0 
Please resolve any mismatches by directly setting properties on BD cell </axi4stream_spi_master_0> to completely resolve these warnings.
Wrote  : <C:\Users\daido\Desktop\Polimi\Anno 4\DESD\Git\KittCarPWM\jstk2_interface\jstk2_interface.srcs\sources_1\bd\test_UART_packet\test_UART_packet.bd> 
Wrote  : <C:/Users/daido/Desktop/Polimi/Anno 4/DESD/Git/KittCarPWM/jstk2_interface/jstk2_interface.srcs/sources_1/bd/test_UART_packet/ui/bd_38c5ed8c.ui> 
VHDL Output written to : c:/Users/daido/Desktop/Polimi/Anno 4/DESD/Git/KittCarPWM/jstk2_interface/jstk2_interface.gen/sources_1/bd/test_UART_packet/synth/test_UART_packet.vhd
VHDL Output written to : c:/Users/daido/Desktop/Polimi/Anno 4/DESD/Git/KittCarPWM/jstk2_interface/jstk2_interface.gen/sources_1/bd/test_UART_packet/sim/test_UART_packet.vhd
VHDL Output written to : c:/Users/daido/Desktop/Polimi/Anno 4/DESD/Git/KittCarPWM/jstk2_interface/jstk2_interface.gen/sources_1/bd/test_UART_packet/hdl/test_UART_packet_wrapper.vhd
INFO: [BD 41-1029] Generation completed for the IP Integrator block digilent_jstk2_0 .
Exporting to file c:/Users/daido/Desktop/Polimi/Anno 4/DESD/Git/KittCarPWM/jstk2_interface/jstk2_interface.gen/sources_1/bd/test_UART_packet/hw_handoff/test_UART_packet.hwh
Generated Block Design Tcl file c:/Users/daido/Desktop/Polimi/Anno 4/DESD/Git/KittCarPWM/jstk2_interface/jstk2_interface.gen/sources_1/bd/test_UART_packet/hw_handoff/test_UART_packet_bd.tcl
Generated Hardware Definition File c:/Users/daido/Desktop/Polimi/Anno 4/DESD/Git/KittCarPWM/jstk2_interface/jstk2_interface.gen/sources_1/bd/test_UART_packet/synth/test_UART_packet.hwdef
[Thu Apr 13 23:35:10 2023] Launched test_UART_packet_digilent_jstk2_0_1_synth_1...
Run output will be captured here: C:/Users/daido/Desktop/Polimi/Anno 4/DESD/Git/KittCarPWM/jstk2_interface/jstk2_interface.runs/test_UART_packet_digilent_jstk2_0_1_synth_1/runme.log
[Thu Apr 13 23:35:11 2023] Launched synth_1...
Run output will be captured here: C:/Users/daido/Desktop/Polimi/Anno 4/DESD/Git/KittCarPWM/jstk2_interface/jstk2_interface.runs/synth_1/runme.log
reset_run test_UART_packet_digilent_jstk2_0_1_synth_1
WARNING: [Vivado 12-1017] Problems encountered:
1. Failed to delete one or more files in run directory C:/Users/daido/Desktop/Polimi/Anno 4/DESD/Git/KittCarPWM/jstk2_interface/jstk2_interface.runs/test_UART_packet_digilent_jstk2_0_1_synth_1

reset_run synth_1
WARNING: [Vivado 12-1017] Problems encountered:
1. Failed to delete one or more files in run directory C:/Users/daido/Desktop/Polimi/Anno 4/DESD/Git/KittCarPWM/jstk2_interface/jstk2_interface.runs/synth_1

launch_runs synth_1 -jobs 6
[Thu Apr 13 23:35:41 2023] Launched test_UART_packet_digilent_jstk2_0_1_synth_1...
Run output will be captured here: C:/Users/daido/Desktop/Polimi/Anno 4/DESD/Git/KittCarPWM/jstk2_interface/jstk2_interface.runs/test_UART_packet_digilent_jstk2_0_1_synth_1/runme.log
[Thu Apr 13 23:35:41 2023] Launched synth_1...
Run output will be captured here: C:/Users/daido/Desktop/Polimi/Anno 4/DESD/Git/KittCarPWM/jstk2_interface/jstk2_interface.runs/synth_1/runme.log
update_module_reference test_UART_packet_digilent_jstk2_0_1
INFO: [IP_Flow 19-5107] Inferred bus interface 'm_axis' of definition 'xilinx.com:interface:axis:1.0' (from Xilinx Repository).
INFO: [IP_Flow 19-5107] Inferred bus interface 's_axis' of definition 'xilinx.com:interface:axis:1.0' (from Xilinx Repository).
INFO: [IP_Flow 19-5107] Inferred bus interface 'aresetn' of definition 'xilinx.com:signal:reset:1.0' (from Xilinx Repository).
INFO: [IP_Flow 19-5107] Inferred bus interface 'aclk' of definition 'xilinx.com:signal:clock:1.0' (from Xilinx Repository).
INFO: [IP_Flow 19-4728] Bus Interface 'aresetn': Added interface parameter 'POLARITY' with value 'ACTIVE_LOW'.
INFO: [IP_Flow 19-4728] Bus Interface 'aclk': Added interface parameter 'ASSOCIATED_BUSIF' with value 'm_axis'.
INFO: [IP_Flow 19-4728] Bus Interface 'aclk': Added interface parameter 'ASSOCIATED_RESET' with value 'aresetn'.
INFO: [IP_Flow 19-234] Refreshing IP repositories
INFO: [IP_Flow 19-1700] Loaded user IP repository 'c:/Users/daido/Desktop/Polimi/Anno 4/DESD/IP/ip_repo'.
Upgrading 'C:/Users/daido/Desktop/Polimi/Anno 4/DESD/Git/KittCarPWM/jstk2_interface/jstk2_interface.srcs/sources_1/bd/test_UART_packet/test_UART_packet.bd'
WARNING: [Vivado 12-1017] Problems encountered:
1. Failed to delete one or more files in run directory C:/Users/daido/Desktop/Polimi/Anno 4/DESD/Git/KittCarPWM/jstk2_interface/jstk2_interface.runs/test_UART_packet_digilent_jstk2_0_1_synth_1

INFO: [IP_Flow 19-1972] Upgraded test_UART_packet_digilent_jstk2_0_1 from digilent_jstk2_v1_0 1.0 to digilent_jstk2_v1_0 1.0
Wrote  : <C:\Users\daido\Desktop\Polimi\Anno 4\DESD\Git\KittCarPWM\jstk2_interface\jstk2_interface.srcs\sources_1\bd\test_UART_packet\test_UART_packet.bd> 
Wrote  : <C:/Users/daido/Desktop/Polimi/Anno 4/DESD/Git/KittCarPWM/jstk2_interface/jstk2_interface.srcs/sources_1/bd/test_UART_packet/ui/bd_38c5ed8c.ui> 
reset_run synth_1
WARNING: [Vivado 12-1017] Problems encountered:
1. Failed to delete one or more files in run directory C:/Users/daido/Desktop/Polimi/Anno 4/DESD/Git/KittCarPWM/jstk2_interface/jstk2_interface.runs/synth_1

launch_runs synth_1 -jobs 6
INFO: [xilinx.com:ip:clk_wiz:6.0-1] /clk_wiz_0 clk_wiz propagate
WARNING: [BD 41-927] Following properties on pin /axi4stream_spi_master_0/aclk have been updated from connected ip, but BD cell '/axi4stream_spi_master_0' does not accept parameter changes, so they may not be synchronized with cell properties:
	PHASE = 0.0 
Please resolve any mismatches by directly setting properties on BD cell </axi4stream_spi_master_0> to completely resolve these warnings.
Wrote  : <C:\Users\daido\Desktop\Polimi\Anno 4\DESD\Git\KittCarPWM\jstk2_interface\jstk2_interface.srcs\sources_1\bd\test_UART_packet\test_UART_packet.bd> 
VHDL Output written to : c:/Users/daido/Desktop/Polimi/Anno 4/DESD/Git/KittCarPWM/jstk2_interface/jstk2_interface.gen/sources_1/bd/test_UART_packet/synth/test_UART_packet.vhd
VHDL Output written to : c:/Users/daido/Desktop/Polimi/Anno 4/DESD/Git/KittCarPWM/jstk2_interface/jstk2_interface.gen/sources_1/bd/test_UART_packet/sim/test_UART_packet.vhd
VHDL Output written to : c:/Users/daido/Desktop/Polimi/Anno 4/DESD/Git/KittCarPWM/jstk2_interface/jstk2_interface.gen/sources_1/bd/test_UART_packet/hdl/test_UART_packet_wrapper.vhd
INFO: [BD 41-1029] Generation completed for the IP Integrator block digilent_jstk2_0 .
Exporting to file c:/Users/daido/Desktop/Polimi/Anno 4/DESD/Git/KittCarPWM/jstk2_interface/jstk2_interface.gen/sources_1/bd/test_UART_packet/hw_handoff/test_UART_packet.hwh
Generated Block Design Tcl file c:/Users/daido/Desktop/Polimi/Anno 4/DESD/Git/KittCarPWM/jstk2_interface/jstk2_interface.gen/sources_1/bd/test_UART_packet/hw_handoff/test_UART_packet_bd.tcl
Generated Hardware Definition File c:/Users/daido/Desktop/Polimi/Anno 4/DESD/Git/KittCarPWM/jstk2_interface/jstk2_interface.gen/sources_1/bd/test_UART_packet/synth/test_UART_packet.hwdef
[Thu Apr 13 23:36:43 2023] Launched test_UART_packet_digilent_jstk2_0_1_synth_1...
Run output will be captured here: C:/Users/daido/Desktop/Polimi/Anno 4/DESD/Git/KittCarPWM/jstk2_interface/jstk2_interface.runs/test_UART_packet_digilent_jstk2_0_1_synth_1/runme.log
[Thu Apr 13 23:36:43 2023] Launched synth_1...
Run output will be captured here: C:/Users/daido/Desktop/Polimi/Anno 4/DESD/Git/KittCarPWM/jstk2_interface/jstk2_interface.runs/synth_1/runme.log
launch_runs: Time (s): cpu = 00:00:00 ; elapsed = 00:00:05 . Memory (MB): peak = 3573.367 ; gain = 0.000
close_design
open_run synth_1 -name synth_1
Design is defaulting to impl run constrset: constrs_1
Design is defaulting to synth run part: xc7a35tcpg236-1
INFO: [Project 1-454] Reading design checkpoint 'c:/Users/daido/Desktop/Polimi/Anno 4/DESD/Git/KittCarPWM/jstk2_interface/jstk2_interface.gen/sources_1/bd/test_UART_packet/ip/test_UART_packet_AXI4Stream_UART_0_1/test_UART_packet_AXI4Stream_UART_0_1.dcp' for cell 'test_UART_packet_i/AXI4Stream_UART_0'
INFO: [Project 1-454] Reading design checkpoint 'c:/Users/daido/Desktop/Polimi/Anno 4/DESD/Git/KittCarPWM/jstk2_interface/jstk2_interface.gen/sources_1/bd/test_UART_packet/ip/test_UART_packet_axi4stream_spi_master_0_1/test_UART_packet_axi4stream_spi_master_0_1.dcp' for cell 'test_UART_packet_i/axi4stream_spi_master_0'
INFO: [Project 1-454] Reading design checkpoint 'c:/Users/daido/Desktop/Polimi/Anno 4/DESD/Git/KittCarPWM/jstk2_interface/jstk2_interface.gen/sources_1/bd/test_UART_packet/ip/test_UART_packet_clk_wiz_0_2/test_UART_packet_clk_wiz_0_2.dcp' for cell 'test_UART_packet_i/clk_wiz_0'
INFO: [Project 1-454] Reading design checkpoint 'c:/Users/daido/Desktop/Polimi/Anno 4/DESD/Git/KittCarPWM/jstk2_interface/jstk2_interface.gen/sources_1/bd/test_UART_packet/ip/test_UART_packet_digilent_jstk2_0_1/test_UART_packet_digilent_jstk2_0_1.dcp' for cell 'test_UART_packet_i/digilent_jstk2_0'
INFO: [Project 1-454] Reading design checkpoint 'c:/Users/daido/Desktop/Polimi/Anno 4/DESD/Git/KittCarPWM/jstk2_interface/jstk2_interface.gen/sources_1/bd/test_UART_packet/ip/test_UART_packet_jstk_uart_bridge_0_0_1/test_UART_packet_jstk_uart_bridge_0_0_1.dcp' for cell 'test_UART_packet_i/jstk_uart_bridge_0_0'
INFO: [Project 1-454] Reading design checkpoint 'c:/Users/daido/Desktop/Polimi/Anno 4/DESD/Git/KittCarPWM/jstk2_interface/jstk2_interface.gen/sources_1/bd/test_UART_packet/ip/test_UART_packet_proc_sys_reset_0_1/test_UART_packet_proc_sys_reset_0_1.dcp' for cell 'test_UART_packet_i/proc_sys_reset_0'
Netlist sorting complete. Time (s): cpu = 00:00:00 ; elapsed = 00:00:00.014 . Memory (MB): peak = 3576.750 ; gain = 0.000
INFO: [Netlist 29-17] Analyzing 72 Unisim elements for replacement
INFO: [Netlist 29-28] Unisim Transformation completed in 0 CPU seconds
INFO: [Project 1-479] Netlist was created with Vivado 2020.2
INFO: [Project 1-570] Preparing netlist for logic optimization
Parsing XDC File [c:/Users/daido/Desktop/Polimi/Anno 4/DESD/Git/KittCarPWM/jstk2_interface/jstk2_interface.gen/sources_1/bd/test_UART_packet/ip/test_UART_packet_proc_sys_reset_0_1/test_UART_packet_proc_sys_reset_0_1_board.xdc] for cell 'test_UART_packet_i/proc_sys_reset_0/U0'
Finished Parsing XDC File [c:/Users/daido/Desktop/Polimi/Anno 4/DESD/Git/KittCarPWM/jstk2_interface/jstk2_interface.gen/sources_1/bd/test_UART_packet/ip/test_UART_packet_proc_sys_reset_0_1/test_UART_packet_proc_sys_reset_0_1_board.xdc] for cell 'test_UART_packet_i/proc_sys_reset_0/U0'
Parsing XDC File [c:/Users/daido/Desktop/Polimi/Anno 4/DESD/Git/KittCarPWM/jstk2_interface/jstk2_interface.gen/sources_1/bd/test_UART_packet/ip/test_UART_packet_proc_sys_reset_0_1/test_UART_packet_proc_sys_reset_0_1.xdc] for cell 'test_UART_packet_i/proc_sys_reset_0/U0'
Finished Parsing XDC File [c:/Users/daido/Desktop/Polimi/Anno 4/DESD/Git/KittCarPWM/jstk2_interface/jstk2_interface.gen/sources_1/bd/test_UART_packet/ip/test_UART_packet_proc_sys_reset_0_1/test_UART_packet_proc_sys_reset_0_1.xdc] for cell 'test_UART_packet_i/proc_sys_reset_0/U0'
Parsing XDC File [c:/Users/daido/Desktop/Polimi/Anno 4/DESD/Git/KittCarPWM/jstk2_interface/jstk2_interface.gen/sources_1/bd/test_UART_packet/ip/test_UART_packet_AXI4Stream_UART_0_1/test_UART_packet_AXI4Stream_UART_0_1_board.xdc] for cell 'test_UART_packet_i/AXI4Stream_UART_0/U0'
Finished Parsing XDC File [c:/Users/daido/Desktop/Polimi/Anno 4/DESD/Git/KittCarPWM/jstk2_interface/jstk2_interface.gen/sources_1/bd/test_UART_packet/ip/test_UART_packet_AXI4Stream_UART_0_1/test_UART_packet_AXI4Stream_UART_0_1_board.xdc] for cell 'test_UART_packet_i/AXI4Stream_UART_0/U0'
Parsing XDC File [c:/Users/daido/Desktop/Polimi/Anno 4/DESD/Git/KittCarPWM/jstk2_interface/jstk2_interface.gen/sources_1/bd/test_UART_packet/ip/test_UART_packet_clk_wiz_0_2/test_UART_packet_clk_wiz_0_2_board.xdc] for cell 'test_UART_packet_i/clk_wiz_0/inst'
Finished Parsing XDC File [c:/Users/daido/Desktop/Polimi/Anno 4/DESD/Git/KittCarPWM/jstk2_interface/jstk2_interface.gen/sources_1/bd/test_UART_packet/ip/test_UART_packet_clk_wiz_0_2/test_UART_packet_clk_wiz_0_2_board.xdc] for cell 'test_UART_packet_i/clk_wiz_0/inst'
Parsing XDC File [c:/Users/daido/Desktop/Polimi/Anno 4/DESD/Git/KittCarPWM/jstk2_interface/jstk2_interface.gen/sources_1/bd/test_UART_packet/ip/test_UART_packet_clk_wiz_0_2/test_UART_packet_clk_wiz_0_2.xdc] for cell 'test_UART_packet_i/clk_wiz_0/inst'
INFO: [Timing 38-35] Done setting XDC timing constraints. [c:/Users/daido/Desktop/Polimi/Anno 4/DESD/Git/KittCarPWM/jstk2_interface/jstk2_interface.gen/sources_1/bd/test_UART_packet/ip/test_UART_packet_clk_wiz_0_2/test_UART_packet_clk_wiz_0_2.xdc:57]
INFO: [Timing 38-2] Deriving generated clocks [c:/Users/daido/Desktop/Polimi/Anno 4/DESD/Git/KittCarPWM/jstk2_interface/jstk2_interface.gen/sources_1/bd/test_UART_packet/ip/test_UART_packet_clk_wiz_0_2/test_UART_packet_clk_wiz_0_2.xdc:57]
Finished Parsing XDC File [c:/Users/daido/Desktop/Polimi/Anno 4/DESD/Git/KittCarPWM/jstk2_interface/jstk2_interface.gen/sources_1/bd/test_UART_packet/ip/test_UART_packet_clk_wiz_0_2/test_UART_packet_clk_wiz_0_2.xdc] for cell 'test_UART_packet_i/clk_wiz_0/inst'
Parsing XDC File [C:/Users/daido/Desktop/Polimi/Anno 4/DESD/Git/KittCarPWM/jstk2_interface/jstk2_interface.srcs/constrs_1/new/PINS.xdc]
Finished Parsing XDC File [C:/Users/daido/Desktop/Polimi/Anno 4/DESD/Git/KittCarPWM/jstk2_interface/jstk2_interface.srcs/constrs_1/new/PINS.xdc]
WARNING: [XPM_CDC_GRAY: TCL-1000] The source and destination clocks are the same. 
     Instance: test_UART_packet_i/AXI4Stream_UART_0/U0/FIFO_DATA_RX/gnuram_async_fifo.xpm_fifo_base_inst/gen_cdc_pntr.rd_pntr_cdc_inst 
  This will add unnecessary latency to the design. Please check the design for the following: 
 1) Manually instantiated XPM_CDC modules: Xilinx recommends that you remove these modules. 
 2) Xilinx IP that contains XPM_CDC modules: Verify the connections to the IP to determine whether you can safely ignore this message.
 [C:/Xilinx/Vivado/2020.2/data/ip/xpm/xpm_cdc/tcl/xpm_cdc_gray.tcl:16]
WARNING: [XPM_CDC_GRAY: TCL-1000] The source and destination clocks are the same. 
     Instance: test_UART_packet_i/AXI4Stream_UART_0/U0/FIFO_DATA_TX/gnuram_async_fifo.xpm_fifo_base_inst/gen_cdc_pntr.wr_pntr_cdc_inst 
  This will add unnecessary latency to the design. Please check the design for the following: 
 1) Manually instantiated XPM_CDC modules: Xilinx recommends that you remove these modules. 
 2) Xilinx IP that contains XPM_CDC modules: Verify the connections to the IP to determine whether you can safely ignore this message.
 [C:/Xilinx/Vivado/2020.2/data/ip/xpm/xpm_cdc/tcl/xpm_cdc_gray.tcl:16]
WARNING: [XPM_CDC_GRAY: TCL-1000] The source and destination clocks are the same. 
     Instance: test_UART_packet_i/AXI4Stream_UART_0/U0/FIFO_DATA_TX/gnuram_async_fifo.xpm_fifo_base_inst/gen_cdc_pntr.rd_pntr_cdc_inst 
  This will add unnecessary latency to the design. Please check the design for the following: 
 1) Manually instantiated XPM_CDC modules: Xilinx recommends that you remove these modules. 
 2) Xilinx IP that contains XPM_CDC modules: Verify the connections to the IP to determine whether you can safely ignore this message.
 [C:/Xilinx/Vivado/2020.2/data/ip/xpm/xpm_cdc/tcl/xpm_cdc_gray.tcl:16]
WARNING: [XPM_CDC_GRAY: TCL-1000] The source and destination clocks are the same. 
     Instance: test_UART_packet_i/AXI4Stream_UART_0/U0/FIFO_DATA_RX/gnuram_async_fifo.xpm_fifo_base_inst/gen_cdc_pntr.wr_pntr_cdc_inst 
  This will add unnecessary latency to the design. Please check the design for the following: 
 1) Manually instantiated XPM_CDC modules: Xilinx recommends that you remove these modules. 
 2) Xilinx IP that contains XPM_CDC modules: Verify the connections to the IP to determine whether you can safely ignore this message.
 [C:/Xilinx/Vivado/2020.2/data/ip/xpm/xpm_cdc/tcl/xpm_cdc_gray.tcl:16]
WARNING: [XPM_CDC_GRAY: TCL-1000] The source and destination clocks are the same. 
     Instance: test_UART_packet_i/AXI4Stream_UART_0/U0/FIFO_DATA_RX/gnuram_async_fifo.xpm_fifo_base_inst/gen_cdc_pntr.wr_pntr_cdc_dc_inst 
  This will add unnecessary latency to the design. Please check the design for the following: 
 1) Manually instantiated XPM_CDC modules: Xilinx recommends that you remove these modules. 
 2) Xilinx IP that contains XPM_CDC modules: Verify the connections to the IP to determine whether you can safely ignore this message.
 [C:/Xilinx/Vivado/2020.2/data/ip/xpm/xpm_cdc/tcl/xpm_cdc_gray.tcl:16]
WARNING: [XPM_CDC_GRAY: TCL-1000] The source and destination clocks are the same. 
     Instance: test_UART_packet_i/AXI4Stream_UART_0/U0/FIFO_DATA_TX/gnuram_async_fifo.xpm_fifo_base_inst/gen_cdc_pntr.wr_pntr_cdc_dc_inst 
  This will add unnecessary latency to the design. Please check the design for the following: 
 1) Manually instantiated XPM_CDC modules: Xilinx recommends that you remove these modules. 
 2) Xilinx IP that contains XPM_CDC modules: Verify the connections to the IP to determine whether you can safely ignore this message.
 [C:/Xilinx/Vivado/2020.2/data/ip/xpm/xpm_cdc/tcl/xpm_cdc_gray.tcl:16]
WARNING: [XPM_CDC_GRAY: TCL-1000] The source and destination clocks are the same. 
     Instance: test_UART_packet_i/AXI4Stream_UART_0/U0/FIFO_DATA_RX/gnuram_async_fifo.xpm_fifo_base_inst/gen_cdc_pntr.rd_pntr_cdc_dc_inst 
  This will add unnecessary latency to the design. Please check the design for the following: 
 1) Manually instantiated XPM_CDC modules: Xilinx recommends that you remove these modules. 
 2) Xilinx IP that contains XPM_CDC modules: Verify the connections to the IP to determine whether you can safely ignore this message.
 [C:/Xilinx/Vivado/2020.2/data/ip/xpm/xpm_cdc/tcl/xpm_cdc_gray.tcl:16]
WARNING: [XPM_CDC_GRAY: TCL-1000] The source and destination clocks are the same. 
     Instance: test_UART_packet_i/AXI4Stream_UART_0/U0/FIFO_DATA_TX/gnuram_async_fifo.xpm_fifo_base_inst/gen_cdc_pntr.rd_pntr_cdc_dc_inst 
  This will add unnecessary latency to the design. Please check the design for the following: 
 1) Manually instantiated XPM_CDC modules: Xilinx recommends that you remove these modules. 
 2) Xilinx IP that contains XPM_CDC modules: Verify the connections to the IP to determine whether you can safely ignore this message.
 [C:/Xilinx/Vivado/2020.2/data/ip/xpm/xpm_cdc/tcl/xpm_cdc_gray.tcl:16]
INFO: [Project 1-1715] 3 XPM XDC files have been applied to the design.
INFO: [Opt 31-138] Pushed 0 inverter(s) to 0 load pin(s).
Netlist sorting complete. Time (s): cpu = 00:00:00 ; elapsed = 00:00:00.001 . Memory (MB): peak = 3669.145 ; gain = 0.000
INFO: [Project 1-111] Unisim Transformation Summary:
  A total of 4 instances were transformed.
  IOBUF => IOBUF (IBUF, OBUFT): 4 instances

launch_runs impl_1 -to_step write_bitstream -jobs 6
INFO: [Timing 38-480] Writing timing data to binary archive.
Writing placer database...
Writing XDEF routing.
Writing XDEF routing logical nets.
Writing XDEF routing special nets.
Write XDEF Complete: Time (s): cpu = 00:00:00 ; elapsed = 00:00:00.045 . Memory (MB): peak = 3669.145 ; gain = 0.000
ERROR: [Common 17-158] 'file' can only be specified once.
[Thu Apr 13 23:40:04 2023] Launched impl_1...
Run output will be captured here: C:/Users/daido/Desktop/Polimi/Anno 4/DESD/Git/KittCarPWM/jstk2_interface/jstk2_interface.runs/impl_1/runme.log
set_property PROBES.FILE {} [get_hw_devices xc7a35t_0]
set_property FULL_PROBES.FILE {} [get_hw_devices xc7a35t_0]
set_property PROGRAM.FILE {C:/Users/daido/Desktop/Polimi/Anno 4/DESD/Git/KittCarPWM/jstk2_interface/jstk2_interface.runs/impl_1/test_UART_packet_wrapper.bit} [get_hw_devices xc7a35t_0]
program_hw_devices [get_hw_devices xc7a35t_0]
INFO: [Labtools 27-3164] End of startup status: HIGH
refresh_hw_device [lindex [get_hw_devices xc7a35t_0] 0]
INFO: [Labtools 27-1434] Device xc7a35t (JTAG device index = 0) is programmed with a design that has no supported debug core(s) in it.
set_property PROBES.FILE {} [get_hw_devices xc7a35t_0]
set_property FULL_PROBES.FILE {} [get_hw_devices xc7a35t_0]
set_property PROGRAM.FILE {C:/Users/daido/Desktop/Polimi/Anno 4/DESD/Git/KittCarPWM/jstk2_interface/jstk2_interface.runs/impl_1/test_UART_packet_wrapper.bit} [get_hw_devices xc7a35t_0]
program_hw_devices [get_hw_devices xc7a35t_0]
INFO: [Labtools 27-3164] End of startup status: HIGH
refresh_hw_device [lindex [get_hw_devices xc7a35t_0] 0]
INFO: [Labtools 27-1434] Device xc7a35t (JTAG device index = 0) is programmed with a design that has no supported debug core(s) in it.
ERROR: [Labtoolstcl 44-513] HW Target shutdown. Closing target: localhost:3121/xilinx_tcf/Digilent/210183AB4CF5A
exit
INFO: [Common 17-206] Exiting Vivado at Thu Apr 13 23:46:08 2023...
